title,tahun,url,abstrak,jenis publikasi
Sistem Pengusir Hama Serangga Otomatis Untuk Pertanian Cerdas Berbasis Fuzzy Logic Mamdani: Studi Kasus: Tanaman Sayur Sawi,2024,https://animator.uho.ac.id/index.php/journal/article/view/1236,"Masalah yang sering dialami oleh para petani pada waktu menanam tanaman sayur Sawi yaitu kurangnya berkembang dengan baik dalam memanennya, karena terserang hama serangga dengan merusak bagian daun tanaman. Salah satunya adalah serangga belalang hijau dan serangga hama kumbang, umumnya masyarakat dalam mengatasi serangan hama serangga masih menggunakan cara lama yaitu dengan cara menggunakan perangkap konvensional dan menyiram lahan pertanian menggunakan solar maupun pestisida yang tentunya menimbulkan efek samping terhadap kerusakan lingkungan dan ekosistem sekitarnya. Penelitian ini bertujuan untuk membuat sistem pengsuir hama serangga otomatis yang dapat menghemat waktu dan tenaga para petani dan membuat pestisida sendiri dari sampah organik, seperti tanaman daun papaya dan daun bawang yang bisa dikelolah menjadi pupuk organik dengan cara di fermentasi. Berdasarkan hasil pengujian menunjukkan bahwa penyusun ini menghasilkan alat sistem pengusir hama serangga otomatis yang beroperasi secara real-time dengan tingkat ketelitian algoritma dan sensor yang tinggi. Algoritma Fuzzy Logic memiliki ketelitian sebesar 92%. Sensor PIR dan sensor ultrasonik, masing-masing memiliki ketelitian sebesar 90, 7% dan 90, 6%. Dan untuk hasil dari skenario pengujian yang diuji coba sebanyak 30 data memliki tingkat keberhasilan sebesar 73%.",jurnal
Rumah Pengering Ikan Bertenaga Surya untuk Peningkatan Kualitas Ikan Asin Kering yang Berkelanjutan,2024,https://mail.almufi.com/index.php/AJPKM/article/view/378,"Pengawetan ikan melalui pengeringan dan penggaraman tradisional sering menghadapi tantangan seperti kualitas yang tidak konsisten, kontaminasi, dan ketergantungan pada bahan bakar fosil. Untuk mengatasi hal ini, program pemberdayaan desa binaan mengembangkan rumah pengering ikan bertenaga surya sebagai solusi berkelanjutan. Tahapan pelaksanaan meliputi penilaian kebutuhan komunitas, desain prototipe, pelatihan pengolah ikan, implementasi, dan evaluasi dampak. Hasilnya menunjukkan kualitas sensorik dan nutrisi ikan asin kering yang lebih baik, seragam, dan bebas kontaminasi. Sistem ini mengurangi biaya operasional dan ketergantungan pada bahan bakar fosil. Pemberdayaan kelompok menjadi fokus utama. Melalui pelatihan, pengolah ikan memperoleh keterampilan untuk mengoperasikan dan memelihara rumah pengering, meningkatkan pendapatan dan kesejahteraan ekonomi. Program ini juga mendorong kolaborasi dan kepemilikan komunitas, memastikan keberlanjutan. Meskipun menghadapi tantangan seperti resistensi awal, program ini memberikan pelajaran berharga tentang keterlibatan dan adaptabilitas. Keberhasilan program ini sejalan dengan Tujuan Pembangunan Berkelanjutan (SDGs) dan berfungsi sebagai model inovatif untuk pembangunan berkelanjutan.",jurnal
RANCANG BANGUN APLIKASI KLASIFIKASI JUDUL SKRIPSI MENGGUNAKAN METODE RATIONAL UNIFIED PROCESS (RUP),2024,https://www.ejournal.itn.ac.id/jati/article/view/11985,"Tugas Akhir (Skripsi) merupakan komponen penting dalam kurikulum pendidikan tinggi di Indonesia yang menjadi syarat utama untuk memperoleh gelar sarjana. Proses pemilihan judul skripsi sering menjadi tantangan bagi mahasiswa, yang sering kali kesulitan menentukan judul yang sesuai dengan minat dan kompetensi mereka. Di sisi lain, dosen pembimbing juga menghadapi kesulitan dalam memberikan saran dan bimbingan yang optimal karena tingginya beban kerja. Pengelolaan data skripsi yang kurang efisien di banyak institusi pendidikan juga menghambat aksesibilitas dan utilisasi data. Aplikasi Klasifikasi Judul Skripsi dikembangkan menggunakan metode Rational Unified Process (RUP) untuk memberikan pendekatan terstruktur dan iteratif yang cocok untuk proyek perangkat lunak kompleks. Aplikasi ini dirancang untuk membantu mahasiswa menemukan judul skripsi yang tepat berdasarkan analisis minat, kompetensi, dan data judul skripsi sebelumnya, mendukung dosen dalam memberikan saran yang lebih efisien, serta mempermudah pengelolaan data skripsi secara terstruktur. Hasil penelitian menunjukkan bahwa aplikasi ini efektif dalam membantu mahasiswa menemukan judul skripsi yang sesuai, mengurangi waktu dan usaha dalam pencarian judul. Aplikasi ini juga mendukung dosen pembimbing dengan menghemat waktu dan tenaga dalam memberikan saran, memungkinkan fokus pada aspek pembimbingan lainnya. Selain itu, pengelolaan data skripsi menjadi lebih terstruktur, memudahkan akses dan pencarian data di masa depan, sehingga meningkatkan efisiensi dan efektivitas pengelolaan data di …",jurnal
PENERAPAN PEMASARAN ONLINE TANAMAN HIDROPONIK MELALUI MARKETPLACE FACEBOOK,2024,https://jurnal.um-tapsel.ac.id/index.php/martabe/article/view/17785,"UMKM Rumah Bali Hidroponik Kendari telah beroperasi sejak tahun 2019, tetapi masih menggunakan metode promosi dan pemasaran tradisional yang membatasi jangkauan penjualannya. Dengan semakin populernya metode menanam tanaman secara hidroponik, terdapat kebutuhan untuk memperluas pasar melalui strategi pemasaran digital. Program Pengabdian Kepada Masyarakat (PKM) ini bertujuan untuk meningkatkan pengetahuan dan keterampilan dalam penerapan pemasaran online melalui Marketplace Facebook bagi UMKM Rumah Bali Hidroponik Kendari. Kegiatan ini dilaksanakan pada 1 Agustus 2024 dan diikuti oleh 20 peserta. Metode pelatihan yang digunakan adalah pendekatan demonstrasi. Hasil evaluasi menunjukkan bahwa sebelum pelatihan, tingkat pengetahuan dan keterampilan peserta mengenai pemasaran online hanya sebesar 65%. Namun, setelah pelatihan, terjadi …",jurnal
Practical Bookkeeping Training for Hydroponic Business Owners at Rumah Bali Hydroponic SMEs,2024,https://abditekper.uho.ac.id/index.php/jat/article/view/13,"Seiring dengan meningkatnya minat terhadap usaha hidroponik, banyak pelaku UMKM di sektor ini, termasuk UMKM Rumah Bali Hidroponik, yang menghadapi kesulitan dalam pengelolaan keuangan yang efisien dan transparan. Salah satu tantangan utama adalah keterbatasan pengetahuan tentang pembukuan yang sederhana namun efektif untuk memantau arus kas dan meningkatkan daya saing usaha. Melalui Program Kemitraan Masyarakat (PKM) ini, kami menyelenggarakan Pelatihan Pembukuan Praktis untuk Pelaku Usaha Hidroponik di UMKM Rumah Bali, yang bertujuan untuk memberikan pelatihan langsung mengenai teknik pencatatan keuangan yang mudah dan aplikatif. Pelatihan ini mencakup topik-topik penting seperti pencatatan pendapatan dan pengeluaran, manajemen kas, serta pembuatan laporan keuangan sederhana. Dengan pendekatan yang praktis dan mudah dipahami, pelaku …",jurnal
Rancang Bangun Portable 2.4 GHz Wi-Fi Repeater pada Mikrokontroler Wemos D1 Mini Pro,2023,https://elektroda.uho.ac.id/index.php/journal/article/view/132,"Portable Wi-Fi Repeater pada frekuensi 2.4 GHz berbasis mikrokontroler merupakan alat untuk menguatkan sinyal Wi-Fi utama menjadi sinyal yang baru dengan kuat sinyal yang baik. Alat ini mempunyai performansi yang baik pada 10 meter terhadap Access Point dan jumlah maksimal client yang dapat ditampung adalah 4 dengan kuat sinyal-62 dBm. Alat ini dapat berguna juga untuk lokasi-lokasi yang tidak terjangkau sinyal Wi-Fi utama sehingga dapat diletakan pada tempat yang terjangkau Wi-Fi utama dengan kuat sinyal-58 dBm sampai-75 dBm atau pada standar baik. Dalam hal ini peneliti berhasil mengubah alat mikrokontroler yaitu Wemos D1 Mini Pro menjadi Wi-Fi Repeater dan dapat memancarkan ulang sinyal wireless. Perbedaan dengan Wi-Fi Repeater yang ada di pasaran hanya berupa bandwith serta jarak, dimana jarak maksimum dari alat ini mencapai 30 meter tanpa hambatan dan bisa mencapai jarak 55 meter dengan menggunakan tambahan antena eksternal.",jurnal
SISTEM PENDUKUNG KEPUTUSAN DALAM PENERIMAAN POLRI MENGGUNAKAN METODE SIMPLE ADDITIVE WEIGHTING (SAW),2023,https://animator.uho.ac.id/index.php/journal/article/view/11,"Profesionalisme bagi polisi sangat penting untuk ditingkatkan dan dimantapkan dalam rangka mewujudkan harapan masyarakat terhadap sosok-sosok polisi yang ideal. Hal ini dimaksudkan untuk memenuhi harapan masyarakat yang membutuhkan polisi dengan sikap ramah dan lemah lembut dalam pelayanan serta tegas dalam penegakan hukum dapat tercapai. Mendukung hal tersebut, Polri telah memperbaiki proses rekrutmen anggota Polri agar semakin berkualitas dengan melakukan perubahan substansi dan kultur yang diwujudkan dalam akselerasi transformasi di tubuh Polri.",jurnal
Rancang Bangun Sistem Informasi Portal Berita Keuangan Provinsi Sulawesi Tenggara Berbasis Website,2023,https://scholar.google.com/scholar?cluster=5350633441758462647&hl=en&oi=scholarr,"Sistem informasi sudah cukup mendorong pengembangan di semua bidang, termasuk dalam bidang layanan keuangan, di mana hampir semuanya sekarang sudah memiliki fasilitas internet. OJK sendiri telah mengembangkan berbagai inovasi berbasis teknologi untuk mendorong pengembangan digitalisasi dan literasi keuangan. Salah satunya adalah desain sistem informasi portal berita untuk Otoritas Jasa Keuangan Sulawesi Tenggara. Sistem informasi portal berita ini bertujuan untuk meningkatkan literasi keuangan masyarakat di kabupaten/kota di Sulawesi Tenggara. Untuk mendapatkan hasil yang diharapkan dari penelitian ini, sistem ini dibuat menggunakan metode waterfall. Metode waterfall adalah metode pengembangan konsep yang menekankan pada langkah-langkah sistematis atau berurutan mulai dari tahap identifikasi hingga tahap penanganan. Pada tahap pengujian, metode yang digunakan …",jurnal
